{
  "schema_version": 2,
  "id": "meu-port",
  "title": "Meu Port",
  "launcher_name": "Meu Port.sh",
  "architecture": "aarch64",
  "executable": "meu-port-universal",
  "argument_mode": "game-dir-and-passthrough",
  "home_mode": "preserve",
  "nxextract": {
    "mode": "auto",
    "version": "1.2.6"
  },
  "required_files": [
    "meu-port-universal"
  ],
  "private_library_paths": [],
  "prepare_script": "",
  "required_capabilities": [
    "host.portmaster",
    "graphics.gles2",
    "input.controller-mapping"
  ],
  "enabled_quirks": [],
  "runtime_report": "log-and-logo"
}
